{
  "event": {
    "designation": "DrupalCon",
    "location": "Sydney",
    "year": "2013",
    "website": "https://sydney2013.drupal.org/",
    "region": "Australia",
    "venue": "Coogee Bay Hotel",
    "timezone": "Australia/Sydney",
    "columns": 3,
    "enabled": true,
    "startDate": "2013-02-05T21:00:00Z",
    "endDate": "2013-02-09T06:45:00Z",
    "flickr": {
      "enabled": true,
      "groupUrl": "https://flic.kr/g/k9tBK",
      "image": "./img/flickr/drupalcon/2013-sydney.jpg",
      "imageAlt": "DrupalCon logo"
    },
    "logo": {
      "image": "./img/logos/drupalcon/2013-sydney.png",
      "imageAlt": "DrupalCon logo",
      "usePlate": false
    },
    "sponsors": [
      {
        "id": "sponsor-5",
        "title": "CrossFunctional",
        "tier": "Platinum",
        "row": 1,
        "priority": 50,
        "image": "./img/sponsors/drupalcon/2013-sydney/sponsor-5.png",
        "imageAlt": "CrossFunctional logo",
        "link": "https://association.drupal.org/node/17128",
        "bgStyle": "auto",
        "aspect": "auto",
        "enabled": true
      },
      {
        "id": "sponsor-6",
        "title": "Technocrat",
        "tier": "Platinum",
        "row": 1,
        "priority": 60,
        "image": "./img/sponsors/drupalcon/2013-sydney/sponsor-6.png",
        "imageAlt": "Technocrat logo",
        "link": "https://association.drupal.org/node/17138",
        "bgStyle": "auto",
        "aspect": "auto",
        "enabled": true
      },
      {
        "id": "sponsor-1",
        "title": "PreviousNext",
        "tier": "Gold",
        "row": 2,
        "priority": 10,
        "image": "./img/sponsors/drupalcon/2013-sydney/sponsor-1.png",
        "imageAlt": "PreviousNext logo",
        "link": "https://association.drupal.org/node/16128",
        "bgStyle": "auto",
        "aspect": "auto",
        "enabled": true
      },
      {
        "id": "sponsor-2",
        "title": "RealityLoop",
        "tier": "Gold",
        "row": 2,
        "priority": 20,
        "image": "./img/sponsors/drupalcon/2013-sydney/sponsor-2.png",
        "imageAlt": "RealityLoop logo",
        "link": "https://association.drupal.org/node/16903",
        "bgStyle": "light-plate",
        "aspect": "auto",
        "enabled": true
      },
      {
        "id": "sponsor-3",
        "title": "Catalyst",
        "tier": "Gold",
        "row": 2,
        "priority": 30,
        "image": "./img/sponsors/drupalcon/2013-sydney/sponsor-3.png",
        "imageAlt": "Catalyst logo",
        "link": "https://association.drupal.org/node/17118",
        "bgStyle": "auto",
        "aspect": "auto",
        "enabled": true
      },
      {
        "id": "sponsor-4",
        "title": "Microsoft",
        "tier": "Gold",
        "row": 2,
        "priority": 40,
        "image": "./img/sponsors/drupalcon/2013-sydney/sponsor-4.png",
        "imageAlt": "Microsoft logo",
        "link": "https://association.drupal.org/node/1344",
        "bgStyle": "light-plate",
        "aspect": "auto",
        "enabled": true
      },
      {
        "id": "sponsor-7",
        "title": "Acquia",
        "tier": "Add-on",
        "row": 3,
        "priority": 70,
        "image": "./img/sponsors/drupalcon/2013-sydney/sponsor-7.png",
        "imageAlt": "Acquia logo",
        "link": "https://association.drupal.org/node/1309",
        "bgStyle": "auto",
        "aspect": "auto",
        "enabled": true
      },
      {
        "id": "sponsor-8",
        "title": "Glo Digital",
        "tier": "Add-on",
        "row": 3,
        "priority": 80,
        "image": "./img/sponsors/drupalcon/2013-sydney/sponsor-8.png",
        "imageAlt": "Glo Digital logo",
        "link": "",
        "bgStyle": "light-plate",
        "aspect": "auto",
        "enabled": true
      },
      {
        "id": "sponsor-9",
        "title": "Commerce Guys",
        "tier": "Add-on",
        "row": 3,
        "priority": 90,
        "image": "./img/sponsors/drupalcon/2013-sydney/sponsor-9.png",
        "imageAlt": "Commerce Guys logo",
        "link": "https://association.drupal.org/node/1324",
        "bgStyle": "light-plate",
        "aspect": "auto",
        "enabled": true
      },
      {
        "id": "sponsor-10",
        "title": "Promet Source",
        "tier": "Add-on",
        "row": 3,
        "priority": 100,
        "image": "./img/sponsors/drupalcon/2013-sydney/sponsor-10.png",
        "imageAlt": "Promet Source logo",
        "link": "https://association.drupal.org/node/13309",
        "bgStyle": "auto",
        "aspect": "auto",
        "enabled": true
      },
      {
        "id": "sponsor-11",
        "title": "Sponsor 11",
        "tier": "Add-on",
        "row": 3,
        "priority": 110,
        "image": "./img/sponsors/drupalcon/2013-sydney/sponsor-11.png",
        "imageAlt": "Sponsor 11 logo",
        "link": "https://association.drupal.org/node/17488",
        "bgStyle": "light-plate",
        "aspect": "auto",
        "enabled": true
      },
      {
        "id": "sponsor-12",
        "title": "Portable Studios",
        "tier": "Add-on",
        "row": 3,
        "priority": 120,
        "image": "./img/sponsors/drupalcon/2013-sydney/sponsor-12.jpg",
        "imageAlt": "Portable Studios logo",
        "link": "https://association.drupal.org/node/17513",
        "bgStyle": "auto",
        "aspect": "auto",
        "enabled": true
      },
      {
        "id": "sponsor-13",
        "title": "Itomic",
        "tier": "Silver",
        "row": 4,
        "priority": 130,
        "image": "./img/sponsors/drupalcon/2013-sydney/sponsor-13.jpg",
        "imageAlt": "Itomic logo",
        "link": "https://association.drupal.org/node/17148",
        "bgStyle": "auto",
        "aspect": "auto",
        "enabled": true
      },
      {
        "id": "sponsor-26",
        "title": "Anchor Hosting Heavyweights",
        "tier": "Silver",
        "row": 4,
        "priority": 135,
        "image": "./img/sponsors/drupalcon/2013-sydney/sponsor-26.png",
        "imageAlt": "Anchor Hosting Heavyweights logo",
        "link": "https://association.drupal.org/node/17413",
        "bgStyle": "auto",
        "aspect": "auto",
        "enabled": true
      },
      {
        "id": "sponsor-14",
        "title": "Acquia",
        "tier": "Silver",
        "row": 4,
        "priority": 140,
        "image": "./img/sponsors/drupalcon/2013-sydney/sponsor-14.png",
        "imageAlt": "Acquia logo",
        "link": "https://association.drupal.org/node/1309",
        "bgStyle": "auto",
        "aspect": "auto",
        "enabled": true
      },
      {
        "id": "sponsor-15",
        "title": "TechNiki.com",
        "tier": "Silver",
        "row": 4,
        "priority": 150,
        "image": "./img/sponsors/drupalcon/2013-sydney/sponsor-15.png",
        "imageAlt": "TechNiki.com logo",
        "link": "https://association.drupal.org/node/17473",
        "bgStyle": "auto",
        "aspect": "auto",
        "enabled": true
      },
      {
        "id": "sponsor-16",
        "title": "Rackspace",
        "tier": "Silver",
        "row": 4,
        "priority": 160,
        "image": "./img/sponsors/drupalcon/2013-sydney/sponsor-16.png",
        "imageAlt": "Rackspace logo",
        "link": "https://association.drupal.org/node/17488",
        "bgStyle": "auto",
        "aspect": "auto",
        "enabled": true
      },
      {
        "id": "sponsor-17",
        "title": "Demonz",
        "tier": "Silver",
        "row": 4,
        "priority": 170,
        "image": "./img/sponsors/drupalcon/2013-sydney/sponsor-17.png",
        "imageAlt": "Demonz logo",
        "link": "https://association.drupal.org/node/17493",
        "bgStyle": "auto",
        "aspect": "auto",
        "enabled": true
      },
      {
        "id": "sponsor-18",
        "title": "Connecting Up",
        "tier": "Bronze",
        "row": 5,
        "priority": 180,
        "image": "./img/sponsors/drupalcon/2013-sydney/sponsor-18.png",
        "imageAlt": "Connecting Up logo",
        "link": "https://association.drupal.org/node/17163",
        "bgStyle": "auto",
        "aspect": "auto",
        "enabled": true
      },
      {
        "id": "sponsor-19",
        "title": "Unknown",
        "tier": "Bronze",
        "row": 5,
        "priority": 190,
        "image": "",
        "imageAlt": "",
        "link": "https://association.drupal.org/node/1714",
        "bgStyle": "auto",
        "aspect": "auto",
        "enabled": true
      },
      {
        "id": "sponsor-20",
        "title": "Agileware",
        "tier": "Supporter & Scholarship",
        "row": 1,
        "priority": 200,
        "image": "./img/sponsors/drupalcon/2013-sydney/sponsor-20.png",
        "imageAlt": "Agileware logo",
        "link": "https://association.drupal.org/node/17233",
        "bgStyle": "auto",
        "aspect": "auto",
        "enabled": true
      },
      {
        "id": "sponsor-21",
        "title": "Green Geeks",
        "tier": "Supporter & Scholarship",
        "row": 6,
        "priority": 210,
        "image": "./img/sponsors/drupalcon/2013-sydney/sponsor-21.png",
        "imageAlt": "Green Geeks logo",
        "link": "https://association.drupal.org/node/13803",
        "bgStyle": "auto",
        "aspect": "auto",
        "enabled": true
      },
      {
        "id": "sponsor-22",
        "title": "Linux Australia",
        "tier": "Supporter & Scholarship",
        "row": 1,
        "priority": 220,
        "image": "./img/sponsors/drupalcon/2013-sydney/sponsor-22.png",
        "imageAlt": "Linux Australia logo",
        "link": "https://association.drupal.org/node/17503",
        "bgStyle": "auto",
        "aspect": "auto",
        "enabled": true
      },
      {
        "id": "sponsor-23",
        "title": "TechWorld",
        "tier": "Media",
        "row": 7,
        "priority": 230,
        "image": "./img/sponsors/drupalcon/2013-sydney/sponsor-23.png",
        "imageAlt": "TechWorld logo",